{
  "$schema": "https://json-schema.org/draft/2020-12/schema",
  "$id": "https://github.com/zhanghao1903/macos-computer-use/blob/main/plugins/codex-claude-engineering-lifecycle/schemas/technical-plan-review-result.schema.json",
  "title": "TechnicalPlanReviewResult",
  "type": "object",
  "additionalProperties": false,
  "required": ["schemaVersion", "type", "workflowId", "messageId", "featureId", "repositoryKey", "routing", "cycle", "createdAt", "body"],
  "properties": {
    "schemaVersion": {"const": 1},
    "type": {"const": "TechnicalPlanReviewResult"},
    "workflowId": {"type": "string", "format": "uuid"},
    "messageId": {"$ref": "#/$defs/digest"},
    "featureId": {"$ref": "#/$defs/featureId"},
    "repositoryKey": {"type": "string", "pattern": "^[A-Za-z0-9_.-]+/[A-Za-z0-9_.-]+$", "maxLength": 300},
    "routing": {"$ref": "#/$defs/routing"},
    "cycle": {"type": "integer", "minimum": 1},
    "createdAt": {"$ref": "#/$defs/timestamp"},
    "body": {
      "type": "object",
      "additionalProperties": false,
      "required": ["requestMessageId", "reviewedPlan", "decision", "findings", "report", "summary"],
      "properties": {
        "requestMessageId": {"$ref": "#/$defs/digest"},
        "reviewedPlan": {
          "type": "object",
          "additionalProperties": false,
          "required": ["planCommitSha", "compositeSha256"],
          "properties": {
            "planCommitSha": {"$ref": "#/$defs/sha"},
            "compositeSha256": {"$ref": "#/$defs/digest"}
          }
        },
        "decision": {"enum": ["PASS", "FAIL"]},
        "findings": {"$ref": "#/$defs/findings"},
        "report": {"$ref": "#/$defs/report"},
        "summary": {"type": "string", "minLength": 1, "maxLength": 500}
      },
      "allOf": [
        {
          "if": {"properties": {"decision": {"const": "PASS"}}, "required": ["decision"]},
          "then": {
            "properties": {
              "findings": {
                "properties": {"blocker": {"const": 0}, "major": {"const": 0}}
              }
            }
          }
        }
      ]
    }
  },
  "$defs": {
    "digest": {"type": "string", "pattern": "^[0-9a-f]{64}$"},
    "sha": {"type": "string", "pattern": "^[0-9a-f]{40}$"},
    "featureId": {"type": "string", "pattern": "^[a-z0-9](?:[a-z0-9-]{0,62}[a-z0-9])?-[0-9a-f]{12}$", "maxLength": 76},
    "timestamp": {"type": "string", "format": "date-time", "pattern": "^\\d{4}-\\d{2}-\\d{2}T\\d{2}:\\d{2}:\\d{2}Z$"},
    "path": {"type": "string", "minLength": 1, "maxLength": 500, "pattern": "^(?!/)(?!.*(?:^|/)\\.\\.(?:/|$))(?!.*\\\\).+$"},
    "routing": {
      "type": "object",
      "additionalProperties": false,
      "required": ["sourceTaskId", "destinationTaskId"],
      "properties": {
        "sourceTaskId": {"type": "string", "minLength": 1, "maxLength": 200},
        "destinationTaskId": {"type": "string", "minLength": 1, "maxLength": 200}
      }
    },
    "findings": {
      "type": "object",
      "additionalProperties": false,
      "required": ["blocker", "major", "minor"],
      "properties": {
        "blocker": {"type": "integer", "minimum": 0},
        "major": {"type": "integer", "minimum": 0},
        "minor": {"type": "integer", "minimum": 0}
      }
    },
    "report": {
      "type": "object",
      "additionalProperties": false,
      "required": ["branch", "path", "commitSha", "sha256"],
      "dependentRequired": {"jsonPath": ["jsonSha256"], "jsonSha256": ["jsonPath"]},
      "properties": {
        "branch": {"type": "string", "pattern": "^codex/review-records/", "maxLength": 240},
        "path": {"$ref": "#/$defs/path"},
        "commitSha": {"$ref": "#/$defs/sha"},
        "sha256": {"$ref": "#/$defs/digest"},
        "jsonPath": {"$ref": "#/$defs/path"},
        "jsonSha256": {"$ref": "#/$defs/digest"}
      }
    }
  }
}
